,title,organization,grant amount,link,deadline,text,keyword search response,keyword source node 1,keyword source node 2,vector search response,vector source node 1,vector source node 1 similarity score,vector source node 2,vector source node 2 similarity score
40,Applications Invited for the Darwin Initiative,"Darwin Initiative
",Not mentioned,https://ngobox.org/full_grant_announcement_Applications-Invited-for-the-Darwin-Initiative-Darwin-Initiative_12437,16/09/2024,"

About the Organization

The Darwin Initiative is a UK government grants scheme that helps conserve biodiversity and support the communities that live alongside it through locally led projects worldwide. It is one of the Biodiversity Challenge Funds (BCFs) – the collective name for three of the UK Government's competitive grants that also includes the Illegal Wildlife Trade Challenge Fund and Darwin Plus, aimed at conserving biodiversity and safeguarding the environment for local people.

Successful Darwin Initiative projects are likely to include:

delivering outputs that will achieve both biodiversity conservation and multidimensional poverty reduction

demonstrated an understanding of GESI within their context, and effectively reflected this in their approach to deliver sustained outcomes

enhancing the capability and capacity of national and local partners and stakeholders, to help ensure a project’s long-term legacy

strengthening, promotion and use of evidence to inform and scale the action

the implementation of a novel or significantly improved approach

scalable approaches that have the potential to deliver greater impact

Since 1993, the Darwin Initiative has awarded over £230m to more than 1,275 projects across 159 countries.

About the Grant

The Darwin Initiative is a UK government grants scheme that helps conserve biodiversity and support the communities that live alongside it through locally led projects worldwide.

Funding Schemes:

Darwin Initiative Extra grants, ranging from £800,000 to £5 million, are intended for projects that are on a clear scaling pathway: building on good evidence from smaller projects and demonstrating the potential to scale further by completion, delivering strong results for biodiversity conservation and multidimensional poverty reduction within its lifetime. Projects should last between 2 to 5 years maximum.

Darwin Initiative Main grants, ranging from £100,000 to £800,000, are expected to deliver strong results for biodiversity conservation and multidimensional poverty reduction based on good evidence, and strongly demonstrate the potential to scale further. Projects should last between 1 to 5 years maximum.

Darwin Initiative Innovation grants, ranging from £10,000 to £200,000, are aimed at projects intending to test and evaluate novel approaches that, if proven, could scale to deliver results for biodiversity conservation and multidimensional poverty reduction. Projects should last between 1 to 2 years maximum.

Darwin Initiative Capability & Capacity grants, ranging from £50,000 to £200,000, are for projects that focus on developing the capability and capacity of identified local and national and local organisations (civil society, research institutes and public bodies) to efficiently deliver effective and successful biodiversity conservation - multidimensional poverty reduction projects. Projects should last 1 to 2 years maximum.

How to Apply

Round 31 of the Darwin Initiative includes the following schemes:

Darwin Initiative Extra

Single stage – now open – deadline Monday 16th September 2024

Shortlisted applications will be invited to interview (remote): Monday 13th – Friday 17th January 2025

Darwin Initiative Main

Stage 1 – now open – deadline Monday 8th July 2024

Stage 2 – by invite only – deadline Monday 2nd December 2024

Darwin Initiative Innovation – now open – deadline Monday 21st October 2024

Darwin Initiative Capability & Capacity – now open – deadline Monday 21st October 2024

Round 31 Guidance for applicants

All applications should be submitted via the Flexi-Grant application portal.

For more information please check the Link

Stay in the loop with the newest RFPs and Grants through NGOBOX's WhatsApp Channel. Join now by clicking here!","Health, Livelihoods","Fundraising and Resource Mobilization
Grant Writing: Assisting NGOs and other organizations in writing proposals to secure funding.
Partnership Development: Building partnerships with donors, corporate sector, and government agencies for resource mobilization.
CSR Consulting: Advising corporations on effective Corporate Social Responsibility (CSR) strategies and projects.",,Miscellaneous,"Fundraising and Resource Mobilization
Grant Writing: Assisting NGOs and other organizations in writing proposals to secure funding.
Partnership Development: Building partnerships with donors, corporate sector, and government agencies for resource mobilization.
CSR Consulting: Advising corporations on effective Corporate Social Responsibility (CSR) strategies and projects.",0.45356056902062747,"Program Design and Implementation
Needs Assessment: Conducting surveys and research to identify the needs of communities and target groups.
Project Planning: Designing comprehensive project plans with clear objectives, timelines, and resource allocation.
Implementation Support: Providing on-ground support to execute programs effectively.",0.4411680797502061
41,"Applications Invited for Challenges in forest management: Climate change, biodiversity & forest products","Velux Stiftung
",Grant Amount: 112183 USD,"https://ngobox.org/full_grant_announcement_Applications-Invited-for-Challenges-in-forest-management--Climate-change,-biodiversity-&-forest-products-Velux-Stiftung_12436",23/09/2024,"

About the Organization

Velux Stiftung is a science-funding foundation based in Switzerland supporting forestry research in Switzerland and globally.

We put our support behind researchers who aim to transfer their discoveries to initiate change and create impact.

The foundation aims to contribute to sustainable change and impact for the benefit of humanity. While there are many important and unsolved topics in the supported funding areas, Velux Stiftung focuses on those ideas or challenges which are relevant and take an interdisciplinary, outside-of-the-box approach but have received too little attention from major funding sources and lack alternative funding opportunities.

We expect our grantees to be knowledge entrepreneurs, to have a clear vision of the impact their research could generate and how they can foster the necessary change. Velux Stiftung aims to support researchers who have the path to impact in mind and want to actively transfer their science-based knowledge beyond the academic community into action and impact. This ultimate objective determines which audiences need to be targeted, and in which form the results should be transferred.

About the Grant

This call for proposals in forestry research is focused on developing or integrating solutions for adapting to or mitigating climate change, promoting biodiversity, providing resilient ecosystems services while supplying sustainable forest products. We’re also seeking proposals that incentivize action and behavioural change, transforming the theoretical and abstract values of forest products and services. We aim to support sound science that aims to be used in practice, as well as efforts to improve understanding and collaboration at the science-practice interface.

The call for proposals 2024 seeks:

Research projects with a high potential for change in forestry practice which include stakeholder engagement, targeted knowledge transfer and with a scalable approach.

Science-practice projects which improve accessibility and comprehensibility in communication, promote mutual understanding through dialogue and knowledge exchange or enables researchers and practitioners to jointly develop research questions.

Applications should contribute towards the overall objective of the program: Sustainable Forest management practice that can address the pressing problems of climate change and biodiversity loss as well as society’s need for forest products such as timber and resilient ecosystem services.

Projects may last from 1 to 4 years, and funding of up to max. CHF 100,000 per year is available. At least two project partners are necessary to be eligible.

Thematic focus:

Innovative and integrative sustainable forest management to develop and provide solutions for adapting to or mitigating climate change, promoting biodiversity, providing resilient ecosystems services and supplying sustainable forest products.

Incentives or tools for action and behavioural change towards sustainable forest management by transforming theoretical and abstract values of forest products and services.

Program goals:

The overall objective of the funding program is to improve sustainable forest management that addresses the pressing problems of climate change and biodiversity loss as well as society’s need for forest products.

The program shall contribute to a change of perspective in sustainable forest management and in the use and value of forests.

The program shall contribute to the integration of evidence-based science into forestry practice.

Financial innovation and improved framework conditions should provide leverage for the implementation of sustainable forest management, resulting in forests that can conserve biodiversity, act as a carbon sink and supply forest products.

How to Apply

The deadline for proposals is 23 September 2024, with a final decision expected in March 2025.

The details of the call 2024 can be viewed here.

For more information please check the Link

Stay in the loop with the newest RFPs and Grants through NGOBOX's WhatsApp Channel. Join now by clicking here!","Health, Livelihoods","Sustainable Fisheries and Coastal Resource Management
Focuses on artisanal marine fisherfolk, promoting sustainable fisheries and balancing coastal resources.
Organizing Fishermen Producer Companies.
Implementing co-management pilot projects in collaboration with state governments.","

Climate X Health
Climate Change Adaptation in Health Systems:
Integrating climate resilience into health facilities, ensuring continuity of healthcare services during emergencies.
Public Health Advocacy and Policy:
Advocating for policies that address climate change impacts on health, such as air quality standards, disaster preparedness, and climate-sensitive disease surveillance.
Engaging in policy dialogue to promote climate-smart health interventions and investments at local, national, and global levels.
Community Awareness and Education:
Conducting awareness campaigns on the health impacts of climate change, emphasizing vulnerable populations such as children, elderly, and those with chronic diseases.
Educating communities on adaptive measures to protect health in the face of climate variability, including heat stress prevention and vector-borne disease management.
Promotion of Sustainable and Resilient Practices:
Promoting sustainable healthcare practices that reduce carbon footprint, such as energy-efficient health facilities, waste management, and renewable energy adoption.
Supporting community-based initiatives for sustainable agriculture, water management, and sanitation to improve environmental health and reduce disease risks.
Research and Data Analysis:
Conducting research on the linkages between climate change and health outcomes, including studies on vector-borne diseases, respiratory illnesses, and mental health impacts.
Analyzing climate and health data to inform evidence-based interventions and policy recommendations.
Capacity Building and Training:Building capacity among healthcare workers and community health volunteers on climate-resilient health practices, emergency response, and disaster risk reduction.Providing training on climate change adaptation strategies in healthcare settings, including the use of climate information for decision-making.
Partnerships and Collaboration:Collaborating with environmental NGOs, government agencies, academic institutions, and international organizations to leverage resources and expertise for climate and health initiatives.Engaging in multi-sectoral partnerships to address broader determinants of health affected by climate change, such as food security, water quality, and ecosystem health.
Monitoring and Evaluation:Monitoring health impacts of climate change and evaluating the effectiveness of interventions in reducing vulnerability and improving resilience.Developing indicators and frameworks for assessing climate-health adaptation strategies and scaling successful models.
Keywords:Health ResilienceClimate-Health ResearchClimate-Sensitive Disease ManagementEnvironmental HealthDisaster Preparedness",Miscellaneous,"Climate X Health
Climate Change Adaptation in Health Systems:
Integrating climate resilience into health facilities, ensuring continuity of healthcare services during emergencies.
Public Health Advocacy and Policy:
Advocating for policies that address climate change impacts on health, such as air quality standards, disaster preparedness, and climate-sensitive disease surveillance.
Engaging in policy dialogue to promote climate-smart health interventions and investments at local, national, and global levels.
Community Awareness and Education:
Conducting awareness campaigns on the health impacts of climate change, emphasizing vulnerable populations such as children, elderly, and those with chronic diseases.
Educating communities on adaptive measures to protect health in the face of climate variability, including heat stress prevention and vector-borne disease management.
Promotion of Sustainable and Resilient Practices:
Promoting sustainable healthcare practices that reduce carbon footprint, such as energy-efficient health facilities, waste management, and renewable energy adoption.
Supporting community-based initiatives for sustainable agriculture, water management, and sanitation to improve environmental health and reduce disease risks.
Research and Data Analysis:
Conducting research on the linkages between climate change and health outcomes, including studies on vector-borne diseases, respiratory illnesses, and mental health impacts.
Analyzing climate and health data to inform evidence-based interventions and policy recommendations.
Capacity Building and Training:Building capacity among healthcare workers and community health volunteers on climate-resilient health practices, emergency response, and disaster risk reduction.Providing training on climate change adaptation strategies in healthcare settings, including the use of climate information for decision-making.
Partnerships and Collaboration:Collaborating with environmental NGOs, government agencies, academic institutions, and international organizations to leverage resources and expertise for climate and health initiatives.Engaging in multi-sectoral partnerships to address broader determinants of health affected by climate change, such as food security, water quality, and ecosystem health.
Monitoring and Evaluation:Monitoring health impacts of climate change and evaluating the effectiveness of interventions in reducing vulnerability and improving resilience.Developing indicators and frameworks for assessing climate-health adaptation strategies and scaling successful models.
Keywords:Health ResilienceClimate-Health ResearchClimate-Sensitive Disease ManagementEnvironmental HealthDisaster Preparedness",0.48275146047297607,"Fundraising and Resource Mobilization
Grant Writing: Assisting NGOs and other organizations in writing proposals to secure funding.
Partnership Development: Building partnerships with donors, corporate sector, and government agencies for resource mobilization.
CSR Consulting: Advising corporations on effective Corporate Social Responsibility (CSR) strategies and projects.",0.4640794918309166
42,Applications Invited for Darwin Initiative Capability & Capacity,"Darwin Initiative
",Grant Amount: 200000 Pound,https://ngobox.org/full_grant_announcement_Applications-Invited-for-Darwin-Initiative-Capability-&-Capacity-Darwin-Initiative_12429,21/10/2024,"

About the Organization

The Darwin Initiative is a UK government grants scheme that helps conserve biodiversity and support the communities that live alongside it through locally led projects worldwide.

Successful Darwin Initiative projects are likely to include:

delivering outputs that will achieve both biodiversity conservation and multidimensional poverty reduction

demonstrated an understanding of GESI within their context, and effectively reflected this in their approach to deliver sustained outcomes

enhancing the capability and capacity of national and local partners and stakeholders, to help ensure a project’s long-term legacy

strengthening, promotion and use of evidence to inform and scale the action

the implementation of a novel or significantly improved approach

scalable approaches that have the potential to deliver greater impact

Since 1993, the Darwin Initiative has awarded over £230m to more than 1,275 projects across 159 countries.

About the Grant

Darwin Initiative Capability & Capacity welcomes applications for projects between £50,000 and £200,000. Projects should focus on developing the capability and capacity of national and local organisations to efficiently deliver effective and successful biodiversity conservation - multidimensional poverty reduction projects. Projects should last between 1 to 2 years maximum.

Funding Schemes:

Extra: Darwin Initiative Extra grants, ranging from £800,000 to £5 million, are intended for projects that are on a clear scaling pathway: building on good evidence from smaller projects and demonstrating the potential to scale further by completion, delivering strong results for biodiversity conservation and multidimensional poverty reduction within its lifetime. Projects should last between 2 to 5 years maximum.

Main: Darwin Initiative Main grants, ranging from £100,000 to £800,000, are expected to deliver strong results for biodiversity conservation and multidimensional poverty reduction based on good evidence, and strongly demonstrate the potential to scale further. Projects should last between 1 to 5 years maximum.

Innovation: Darwin Initiative Innovation grants, ranging from £10,000 to £200,000, are aimed at projects intending to test and evaluate novel approaches that, if proven, could scale to deliver results for biodiversity conservation and multidimensional poverty reduction. Projects should last between 1 to 2 years maximum.

Capability & Capacity: Darwin Initiative Innovation grants, ranging from £10,000 to £200,000, are aimed at projects intending to test and evaluate novel approaches that, if proven, could scale to deliver results for biodiversity conservation and multidimensional poverty reduction. Projects should last between 1 to 2 years maximum.

How to Apply

All applications should be submitted via the Flexi-Grant application portal.

Applications to Round 31 of Darwin Initiative Capability & Capacity are now open.

The latest application Round opened on Wednesday 22nd May 2024.

Applications to Darwin Initiative Capability & Capacity are a single-stage process.

Deadline for applications: Monday 21st October 2024

Results are expected by end of January 2025 at the earliest

The expected start date for successful projects is from 1st April 2025.

For more information please check the Link

Stay in the loop with the newest RFPs and Grants through NGOBOX's WhatsApp Channel. Join now by clicking here!","Health, Livelihoods","Fundraising and Resource Mobilization
Grant Writing: Assisting NGOs and other organizations in writing proposals to secure funding.
Partnership Development: Building partnerships with donors, corporate sector, and government agencies for resource mobilization.
CSR Consulting: Advising corporations on effective Corporate Social Responsibility (CSR) strategies and projects.",,Miscellaneous,"Program Design and Implementation
Needs Assessment: Conducting surveys and research to identify the needs of communities and target groups.
Project Planning: Designing comprehensive project plans with clear objectives, timelines, and resource allocation.
Implementation Support: Providing on-ground support to execute programs effectively.",0.46492625222264755,"Fundraising and Resource Mobilization
Grant Writing: Assisting NGOs and other organizations in writing proposals to secure funding.
Partnership Development: Building partnerships with donors, corporate sector, and government agencies for resource mobilization.
CSR Consulting: Advising corporations on effective Corporate Social Responsibility (CSR) strategies and projects.",0.4638500675343604
43,Applications Invited for TaroWorks Technology Grant ,"TaroWorks
",Grant Amount: 20000 USD,https://ngobox.org/full_grant_announcement_Applications-Invited-for-TaroWorks-Technology-Grant--TaroWorks_12417,On Rolling Basis,"

About the Organization

TaroWorks is a last-mile mobile app and field data solution empowering non-profit organizations and social enterprises to monitor field operations, manage inventory and maximize their impact. The TaroWorks & Salesforce solution has been used by over 100+ non-profits and social enterprises across over 60 countries in the world. TaroWorks was launched within and is fully owned by the Grameen Foundation, a global non-profit that enables the poor, especially women, to create a world without poverty and hunger.

The TaroWorks Enterprise mobile inventory management app that extends TaroWorks to help organizations track their supply chain, from procurement, to product transfers, to last-mile distribution - even from offline smartphones or tablets.

About the Grant

TaroWorks is Seeking Humanitarian Aid Organizations Ready to Transform Their Field Operations With Last-Mile Mobile Technology.

Are you an NGO providing humanitarian aid to vulnerable populations through the distribution of physical goods & products?

Are you struggling with disparate & inefficient data systems to track your distribution and your impact?

Are you ready to scale your last-mile operations and maximize your impact through the use of mobile & cloud technology?

Apply now for a $20,000 grant to help you implement TaroWorks Enterprise & Salesforce CRM to monitor your field operations, manage your supply chain, and maximize your impact.

Eligibility

TaroWorks will evaluate applications based on organization needs, the potential for long-term success with the system, estimated long-term impact, and financial need.

In order to be eligible, you must be a non-profit organization Providing Humanitarian Aid to Vulnerable Populations, with a focus on Refugees, Displaced communities, and Victims of Conflict/Crisis. You must be distributing some type of physical goods, products, or assets through a supply chain that TaroWorks Enterprise can help you better monitor and manage.

Additional Eligibility Criteria:

Organizations should demonstrate a clear strategy and process requirements for last-mile distribution operations.

Organizations must have or plan to hire a technical resource (e.g., database manager, CRM systems manager) that will manage the TaroWorks & Salesforce IT system.

Support is only available in English, so TaroWorks can only work with English-speaking system administrators.

Organizations must be able and willing to pay for ongoing annual TaroWorks Enterprise licenses.

How to Apply

Deadline: JUNE 7, 2024

Apply now

For more information please check the Link

Stay in the loop with the newest RFPs and Grants through NGOBOX's WhatsApp Channel. Join now by clicking here!","Health, Consulting","Fundraising and Resource Mobilization
Grant Writing: Assisting NGOs and other organizations in writing proposals to secure funding.
Partnership Development: Building partnerships with donors, corporate sector, and government agencies for resource mobilization.
CSR Consulting: Advising corporations on effective Corporate Social Responsibility (CSR) strategies and projects.","Monitoring and Evaluation (M&E)
Baseline Studies: Establishing initial conditions to measure progress against.
Impact Assessment: Evaluating the outcomes and impact of projects to ensure they meet their goals.
Evaluations: These include baseline, midline, endline studies, process evaluation, knowledge documentation, program evaluation, longitudinal studies etc.","Health, Livelihoods","Fundraising and Resource Mobilization
Grant Writing: Assisting NGOs and other organizations in writing proposals to secure funding.
Partnership Development: Building partnerships with donors, corporate sector, and government agencies for resource mobilization.
CSR Consulting: Advising corporations on effective Corporate Social Responsibility (CSR) strategies and projects.",0.5518081407789217,"Agricultural Development and Farmer Support
Targets small and marginal farmers, aiming to create wealthy, resilient, and responsible farming communities.
Provides support and proof of concept for agricultural enterprise models.
Focus on rainfed regions and marginalized communities.

HIV Risk Reduction for Vulnerable Populations
Reducing vulnerability to HIV through targeted interventions and support programs.",0.4909387053287776
