,title,organization,grant amount,link,deadline,text,keyword search response,keyword source node 1,keyword source node 2,vector search response,vector source node 1,vector source node 1 similarity score,vector source node 2,vector source node 2 similarity score
10,Applications Invited for the Circle: Innovation Funding Grant 24-25,"The Circle
",Grant Amount: 100000 INR,https://ngobox.org/full_grant_announcement_Applications-Invited-for-the-Circle--Innovation-Funding-Grant-24-25-The-Circle_12554,15/09/2024,"

About the Organization

The Circle supports micro-innovations in classrooms, schools, and communities through the utilisation of micro-grants.

About the Grant

The Circle supports micro-innovations in classrooms, schools, and communities through the utilisation of micro-grants. We will offer innovation grants up to one lakh to educators who want to reinvent education.

To ensure that our leaders are aiming for breakthrough and imaginative solutions which have the potential to be game-changing, we want to encourage people – who are ready – to begin innovating, experimenting, and aiming for a reimagined education, and start to build momentum.

Selection Criteria:

Vision of excellence: Does your innovation show a clear path to improved student outcomes which are clearly articulated?

Commitment: Are you committed to serving underserved children, and focusing on direct impact?

Clarity of thought: Do you have clarity on how your grant funding will be allocated most efficiently for maximum positive impact?

Monitoring & Evaluation:

Monthly Learning Loops: Circles: Each month, grant awardees will focus on sharing updates on fund allocation, key artefacts, and progress in student outcomes as well as trobuleshooting challenges with their peers

Site Visits: Throughout the grant period, we'll create opportuntiies to witness the microinnovation on the ground

End of program showcase: Towards the end of the grant (April), the grant awardees are expected to share their project learnings with a larger community of educators through a virtual showcase

Artefact Collection: Throughout the grant, the participants will collect pictures/videos/testimonials from their project for rigorous documentation

How to Apply

Deadline for application: September 15, 2024 | 11.59 PM

Apply here

Read out to suhani.j@thecircleindia.org for questions!

For more information please check the Link

Be A Part of Asia’s Largest CSR & Sustainability Forum- India CSR Summit & ESG Forum 2024 | 16th*, 17th & 18th October 2024",Livelihoods,"Fundraising and Resource Mobilization
Grant Writing: Assisting NGOs and other organizations in writing proposals to secure funding.
Partnership Development: Building partnerships with donors, corporate sector, and government agencies for resource mobilization.
CSR Consulting: Advising corporations on effective Corporate Social Responsibility (CSR) strategies and projects.",,Livelihoods,"Fundraising and Resource Mobilization
Grant Writing: Assisting NGOs and other organizations in writing proposals to secure funding.
Partnership Development: Building partnerships with donors, corporate sector, and government agencies for resource mobilization.
CSR Consulting: Advising corporations on effective Corporate Social Responsibility (CSR) strategies and projects.",0.5644801672023138,"Community Engagement and Mobilization
Participatory Approaches: Engaging communities in the planning and implementation of projects to ensure their needs and perspectives are considered.
Awareness Campaigns: Conducting campaigns to raise awareness about social issues like health, education, and gender equality.
Stakeholder Consultation: Facilitating discussions among various stakeholders to build consensus and collaboration.",0.47956024477249376
11,Applications Invited for Wildlife Acoustics grant Scientific Product Grant Program ,"Wildlife Acoustics
",Grant Amount: 4000 USD,https://ngobox.org/full_grant_announcement_Applications-Invited-for-Wildlife-Acoustics-grant-Scientific-Product-Grant-Program--Wildlife-Acoustics_12552,15/11/2024,"

About the Organization

Wildlife Acoustics creates the world’s leading wildlife acoustic monitoring tools, specially designed to help scientists make impactful discoveries that expand our understanding of this biologically diverse planet.

A passionate and innovative group of technologists, operational experts, wildlife enthusiasts and conservationists, we have a zeal for helping our customers succeed in their research —understanding their needs and creating wildlife audio recording and analysis tools specially designed to help them conduct research across the globe.

About the Grant

Wildlife Acoustics is proud to offer a grant program to support the advancement of wildlife research, habitat monitoring, and environmental conservation. Our quarterly grant program provides scientists with bioacoustics research tools to further their study of bats, birds, amphibians, and other vocal wildlife.

We are happy to announce a new addition to our grant program! In response to overwhelming demand, we have established a “Kaleidoscope Pro-only” grant option for our esteemed applicants. We value your commitment to making a positive impact and understand that time is of the essence, so we have streamlined these applications to get you back in the field (or lab!) quicker. Here are some highlights:

Streamlined application for those wanting Kaleidoscope Pro only

Unlimited Kaleidoscope Pro licenses for eligible applicants

One-year, annual memberships awarded quarterly

Applicants may reapply

Kaleidoscope Pro-Only Grant

Wildlife Acoustics may award an unlimited number of Kaleidoscope Pro licenses to selected grant recipients worldwide every quarter. Individual applicants may request an unlimited number of software licenses.

In General

Grant recipients must be associated with a charitable, educational, NGOs, or other tax-exempt organization. Consideration will be given to projects that make significant and novel use of wildlife vocalization recordings for data collection and/or analysis.

The work advances scientific knowledge and contributes to long-term conservation.

The grant would have a significant impact on the success of the project.

The application provides adequate information to facilitate project evaluation, including detailed expected outcomes and the need for bioacoustics data to support those outcomes.

The project must begin within one year of the award.

Eligibility

If you receive a grant, you’ll be expected to:

Provide written acceptance of the grant and agree to the applicable terms and conditions.

Maintain contact with Wildlife Acoustics to provide:

Quarterly project updates for the duration of your project (Standard Product Grant); or

One annual project update per Kaleidoscope Pro license awarded for the duration of the project (Kaleidoscope Pro-Only Grant).

Acknowledge the support of Wildlife Acoustics, Inc., in any presentations, meetings, publications, and/or materials mentioning or resulting from the project, whenever possible.

Submit a final report within two months of project completion (or within two months of the bioacoustics section/phase if part of a larger biodiversity project)

How to Apply

You can apply for our grant here

All sections of the application must be completed in English.

You must include one letter of recommendation (written in English); however, you may submit up to two letters of recommendation and/or letters of reference that you feel would be helpful. (Note: a letter of recommendation/reference is not required for Kaleidoscope Pro-only grant applications.)

You will be asked to include a copy of your organization's certificate/tax exemption letter showing tax-exempt and charitable or educational status. For countries without these, you will be responsible for covering any applicable taxes.

If you are unable to complete the application all at once, you can save your work and come back later to finish and submit your application.

If you have previously applied for a grant and were not awarded, you are welcome to apply again.

Only applications that are fully completed will be evaluated. This includes all required fields in the form, in addition to at least one letter of recommendation.

Deadline: November 15, 2024

For more information please check the Link

Be A Part of Asia’s Largest CSR & Sustainability Forum- India CSR Summit & ESG Forum 2024 | 16th*, 17th & 18th October 2024",Consulting,"Fundraising and Resource Mobilization
Grant Writing: Assisting NGOs and other organizations in writing proposals to secure funding.
Partnership Development: Building partnerships with donors, corporate sector, and government agencies for resource mobilization.
CSR Consulting: Advising corporations on effective Corporate Social Responsibility (CSR) strategies and projects.","Program Design and Implementation
Needs Assessment: Conducting surveys and research to identify the needs of communities and target groups.
Project Planning: Designing comprehensive project plans with clear objectives, timelines, and resource allocation.
Implementation Support: Providing on-ground support to execute programs effectively.",Miscellaneous,"Fundraising and Resource Mobilization
Grant Writing: Assisting NGOs and other organizations in writing proposals to secure funding.
Partnership Development: Building partnerships with donors, corporate sector, and government agencies for resource mobilization.
CSR Consulting: Advising corporations on effective Corporate Social Responsibility (CSR) strategies and projects.",0.5066221083976938,"Program Design and Implementation
Needs Assessment: Conducting surveys and research to identify the needs of communities and target groups.
Project Planning: Designing comprehensive project plans with clear objectives, timelines, and resource allocation.
Implementation Support: Providing on-ground support to execute programs effectively.",0.46164251561142483
12,Applications Invited for Million Dollar Bike Ride Pilot Grant Program ,"The Orphan Disease Center
",Not mentioned,https://ngobox.org/full_grant_announcement_Applications-Invited-for-Million-Dollar-Bike-Ride-Pilot-Grant-Program--The-Orphan-Disease-Center_12550,20/09/2024,"

About the Organization

The Orphan Disease Center will develop transformative therapies using platform technologies that can be deployed across multiple rare diseases. We will emphasize disorders with substantial unmet need independent of their incidence and will strive to assure access to patients of all populations.

About the Grant

The ODC is offering 42 research opportunities focusing on 34 different rare diseases. This program provides a one-year grant to support research related to a rare disease represented in the 2024 Million Dollar Bike Ride. Number of awards and dollar amounts vary per disease based on fundraising totals by each disease team.

Eligibility

This RFA is open globally. International applicants are invited to apply. All individuals holding a faculty‐level appointment at an academic institution or a senior scientific position at a non-profit institution or foundation are eligible to respond to this RFA.

How to Apply

Complete the Application Form on Submittable.

Letter of Interest (LOI) Applications are Due Friday, September 20th, 2024 by 8pm ET

For more information please check the Link

Be A Part of Asia’s Largest CSR & Sustainability Forum- India CSR Summit & ESG Forum 2024 | 16th*, 17th & 18th October 2024",Health,"Fundraising and Resource Mobilization
Grant Writing: Assisting NGOs and other organizations in writing proposals to secure funding.
Partnership Development: Building partnerships with donors, corporate sector, and government agencies for resource mobilization.
CSR Consulting: Advising corporations on effective Corporate Social Responsibility (CSR) strategies and projects.","

Climate X Health
Climate Change Adaptation in Health Systems:
Integrating climate resilience into health facilities, ensuring continuity of healthcare services during emergencies.
Public Health Advocacy and Policy:
Advocating for policies that address climate change impacts on health, such as air quality standards, disaster preparedness, and climate-sensitive disease surveillance.
Engaging in policy dialogue to promote climate-smart health interventions and investments at local, national, and global levels.
Community Awareness and Education:
Conducting awareness campaigns on the health impacts of climate change, emphasizing vulnerable populations such as children, elderly, and those with chronic diseases.
Educating communities on adaptive measures to protect health in the face of climate variability, including heat stress prevention and vector-borne disease management.
Promotion of Sustainable and Resilient Practices:
Promoting sustainable healthcare practices that reduce carbon footprint, such as energy-efficient health facilities, waste management, and renewable energy adoption.
Supporting community-based initiatives for sustainable agriculture, water management, and sanitation to improve environmental health and reduce disease risks.
Research and Data Analysis:
Conducting research on the linkages between climate change and health outcomes, including studies on vector-borne diseases, respiratory illnesses, and mental health impacts.
Analyzing climate and health data to inform evidence-based interventions and policy recommendations.
Capacity Building and Training:Building capacity among healthcare workers and community health volunteers on climate-resilient health practices, emergency response, and disaster risk reduction.Providing training on climate change adaptation strategies in healthcare settings, including the use of climate information for decision-making.
Partnerships and Collaboration:Collaborating with environmental NGOs, government agencies, academic institutions, and international organizations to leverage resources and expertise for climate and health initiatives.Engaging in multi-sectoral partnerships to address broader determinants of health affected by climate change, such as food security, water quality, and ecosystem health.
Monitoring and Evaluation:Monitoring health impacts of climate change and evaluating the effectiveness of interventions in reducing vulnerability and improving resilience.Developing indicators and frameworks for assessing climate-health adaptation strategies and scaling successful models.
Keywords:Health ResilienceClimate-Health ResearchClimate-Sensitive Disease ManagementEnvironmental HealthDisaster Preparedness",Miscellaneous,"Fundraising and Resource Mobilization
Grant Writing: Assisting NGOs and other organizations in writing proposals to secure funding.
Partnership Development: Building partnerships with donors, corporate sector, and government agencies for resource mobilization.
CSR Consulting: Advising corporations on effective Corporate Social Responsibility (CSR) strategies and projects.",0.533317633882875,"Pandemic & Vaccinations
Awareness and Education Campaigns:
Conducting community outreach programs to educate caregivers and communities about the importance of vaccination.
Dispelling myths and addressing vaccine hesitancy through targeted communication strategies.
Organizing workshops, seminars, and interactive sessions to increase knowledge about vaccine-preventable diseases and vaccination schedules.
Vaccination Drives and Campaigns:
Collaborating with government health authorities to organize mass vaccination campaigns, especially during national immunization days or special vaccination drives.
Mobilizing resources and volunteers to facilitate vaccination sessions in remote or underserved areas.
Providing logistical support such as transportation and cold chain management for vaccine distribution.
Capacity Building and Training:
Training healthcare workers, community health volunteers, and frontline workers on vaccination protocols, storage, administration, and adverse event management.
Building local capacity to monitor and report vaccination coverage data accurately.
Advocacy and Policy Influence:
Advocating for policies that prioritize immunization, ensure vaccine availability, and promote equitable access to vaccines.
Engaging with policymakers, stakeholders, and donors to support sustainable immunization programs and funding initiatives.
Monitoring policy implementation and advocating for improvements in vaccination coverage and service delivery.
Monitoring and Evaluation:
Monitoring vaccination coverage rates and conducting evaluations to assess program effectiveness and identify areas for improvement.
Using data to track immunization trends, identify underserved populations, and implement targeted interventions.
Using and/or developing environmental health surveillance tools for surveillance of pandemic/disease outbreak for example through wastewater surveillance. 
Research and Innovation:
Conducting research on vaccine-preventable diseases, vaccine efficacy, and immunization strategies tailored to local contexts.
Piloting innovative approaches such as mobile vaccination clinics, digital health solutions for tracking vaccination status, or community-based vaccination models.
Partnerships and Collaboration:
Collaborating with international organizations, governments, private sector partners, and other NGOs to leverage resources, expertise, and networks.
Forming alliances with community leaders, religious institutions, schools, and local organizations to promote vaccination acceptance and uptake.
Emergency Response and Crisis Management:
Responding to disease outbreaks or emergencies by supporting rapid vaccination campaigns and emergency preparedness plans.
Mobilizing resources and coordinating efforts with health authorities and humanitarian agencies during health crises.
Keywords:
Vaccine
Vaccination
Pandemic
Outbreak",0.4876431633065559
13,Applications Invited for Global Youth Grant Scheme :Going Together – For Youth Creativity & Well-being,"​​​UNESCO x SEVENTEEN
",Grant Amount: 10000 USD,https://ngobox.org/full_grant_announcement_Applications-Invited-for-Global-Youth-Grant-Scheme--Going-Together-–-For-Youth-Creativity-&-Well-being-​​​UNESCO-x-SEVENTEEN_12549,30/09/2024,"

About the Organization

UNESCO is the United Nations Educational, Scientific and Cultural Organization. With its extensive thematic mandate and more than 20 years of experience in empowering young people and facilitating youth initiatives, UNESCO is well equipped to provide a comprehensive response to youth issues. UNESCO's response is deployed in an integrated manner, connecting strategic and policy design with community actions, facilitated by a coordination between Headquarters and an extensive network of field offices. This project aligns with the Organization's strategic and programmatic priorities on youth, as it promotes and supports youth-led solutions through a global grants programme.

SEVENTEEN, since their debut in 2015, has actively engaged in social initiatives encouraging young people to act on pressing issues. Their participation in the 13thUNESCOYouth Forum saw massivepublic engagement, underscoringthe powerful role artists play inamplifying youth voices. SEVENTEEN’s motivation is to spread positivity and hope, ensuring young people never abandon their dreams. Role models like SEVENTEEN are essential supporting solidarity, inclusion and meaningful change.

About the Grant

“Going Together – For Youth Creativity and Well-Being”, the Global Youth Grant Scheme with UNESCO and K-pop group SEVENTEEN, will fund 100 youth-led action projects worldwide.

On 26 June 2024, the day of SEVENTEEN’s nomination as the first-ever UNESCO Goodwill Ambassador for Youth, the group and UNESCO’s Director-General announced the launch of the joint grant scheme to support youth projects across all regions.

SEVENTEEN will contribute $1 million to fund this initiative.

GOING TOGETHER – For Youth Creativity & Well-Being is an initiative implemented by UNESCO, SEVENTEEN and PLEDIS ENTERTAINMENT, which seeks to support young people's ideas thrive and contribute to addressing challenges that affect the well-being and development of youth and their communities. As such, it provides them with the resources and skills necessary to implement innovative projects that have a positive social impact in their communities.

To this end, a maximum of 100 project leaders will be selected worldwide to receive training and mentoring throughout their project implementation, as well as seed funding ranging from 5,000 to a maximum of 10,000 USD as set out in the enclosed Terms and Conditions of the grant.

The project will be initiated with a worldwide call for applications. Subject to the availability of funds, support will be provided for youth-led projects that address challenges affecting the well-being and development of young people and their communities, within three thematic areas:

Promoting youth confidence and resilience through music, arts, and sports

Building creative communities together with youth

Supporting youth mental health and well-being

The Grant Scheme will support project leaders aged from 18 to 30 years old, from different backgrounds and regions.

How to Apply

If you wish to apply, you are invited to submit your project proposal by 30 September 2024, 23:59 CET! Applications submitted after this deadline shall not be considered.

If you have any questions, contact us at goingtogether@unesco.org.

The working language of the initiative is in English and as such the form should be completed in this language.

Please find the Terms and Conditions of this Call here: https://unesdoc.unesco.org/ark:/48223/pf0000390925

Register here!

For more information please check the Link

Be A Part of Asia’s Largest CSR & Sustainability Forum- India CSR Summit & ESG Forum 2024 | 16th*, 17th & 18th October 2024","Health, Consulting","Fundraising and Resource Mobilization
Grant Writing: Assisting NGOs and other organizations in writing proposals to secure funding.
Partnership Development: Building partnerships with donors, corporate sector, and government agencies for resource mobilization.
CSR Consulting: Advising corporations on effective Corporate Social Responsibility (CSR) strategies and projects.","Program Design and Implementation
Needs Assessment: Conducting surveys and research to identify the needs of communities and target groups.
Project Planning: Designing comprehensive project plans with clear objectives, timelines, and resource allocation.
Implementation Support: Providing on-ground support to execute programs effectively.",Miscellaneous,"Fundraising and Resource Mobilization
Grant Writing: Assisting NGOs and other organizations in writing proposals to secure funding.
Partnership Development: Building partnerships with donors, corporate sector, and government agencies for resource mobilization.
CSR Consulting: Advising corporations on effective Corporate Social Responsibility (CSR) strategies and projects.",0.4744910116425733,"Community Engagement and Mobilization
Participatory Approaches: Engaging communities in the planning and implementation of projects to ensure their needs and perspectives are considered.
Awareness Campaigns: Conducting campaigns to raise awareness about social issues like health, education, and gender equality.
Stakeholder Consultation: Facilitating discussions among various stakeholders to build consensus and collaboration.",0.46309844402558753
