,title,organization,grant amount,link,deadline,text,keyword search response,keyword source node 1,keyword source node 2,vector search response,vector source node 1,vector source node 1 similarity score,vector source node 2,vector source node 2 similarity score
0,Applications Invited for Light­house Found­a­tion (LF) Project Grant ,"Light­house Found­a­tion (LF)
",Not mentioned,https://ngobox.org/full_grant_announcement_Applications-Invited-for-Light­house-Found­a­tion-(LF)-Project-Grant--Light­house-Found­a­tion-(LF)_12568,30/09/2024,"

About the Organization

Earth's oceans are what give our planet its identity - the blue planet, the watery globe. They are the cradle of life, the region with the highest level of biodiversity we know, an irreplaceable source of food, a source and a storage chamber in world-scale chemical and energy cycles, the engine of earth's climate. The oceans determine the nature and quality of the biosphere far beyond their coastlines. They are the sustaining, all-encompassing element in the global biosphere.

The Lighthouse Foundation supports integrated and long-term approaches in the relationship between humans and the marine environment within the context of sustainable development.

About the Grant

In accordance with the orientation of the LF, projects and measures must have a maritime theme and be suitable as models for follow-up projects and measures in other regions of the world. They must be of such a nature as to make people in other regions receptive to the theme and make a concrete contribution to an enhanced awareness of the maritime world.

Receptivity for and an awareness of sustainable development should not be narrowed down to sustained utilization of maritime resources. The important thing is to make it clear that the natural world in its biological and physical phenomenology is of value per se and cannot be reduced to the isolated aspect of satisfaction of human needs.

The usefulness and visibility factor of a pro­ject or meas­ure are closely re­lated in the view of the LF. A high pro­file and wide­spread dis­sem­in­a­tion of in­form­a­tion on activ­it­ies gen­er­ate the kind of pos­it­ive at­ten­tion and curi­os­ity mari­time themes and prob­lems de­serve. What we need to eval­u­ate a pro­ject or meas­ure is a clear-cut de­scrip­tion of the con­tri­bu­tion it will make.

Coastal regions are the target regions for meas­ures and pro­jects geared to sus­tained de­vel­op­ment in the mari­time field. The eco­lo­gical land/​sea bound­ary is at the same time the hu­man/​sea in­ter­face and thus the fo­cal point of the rel­ev­ant eco­lo­gical, eco­nomic and so­cial chal­lenges.

Interdisciplinary and inter-sector activities con­sti­tute the most prom­ising ap­proaches for ini­ti­ation of sus­tained de­vel­op­ment pro­cesses in the mari­time field. The con­cerns of re­gional pop­u­la­tions must be a cent­ral fo­cus and local per­son­al­it­ies should be en­gaged as driv­ing forces be­hind the activ­it­ies.

Methods of project realization: Both the meth­ods and or­gan­iz­a­tion em­ployed by in­sti­tu­tions and per­sons re­spons­ible for the pro­jects or meas­ures must re­flect the prin­ciple of sus­tain­ab­il­ity.

Regional developmental impulses: Pro­jects and meas­ures aim­ing at co-op­er­a­tion on re­gional de­vel­op­ment must gen­er­ate clearly defined and re­cog­niz­able de­vel­op­mental im­pulses within a pat­ently re­gional frame­work. The ob­ject­ive must be to im­prove the liv­ing con­di­tions of the re­gional pop­u­la­tion in a sus­tain­able man­ner and to con­trib­ute dir­ectly to a palp­able re­duc­tion of re­source con­sump­tion.

Exemplary function: Pro­jects and meas­ures geared solely to an in­di­vidual situ­ation with little rel­ev­ance to wider circles can only be ap­plied to other situ­ations in other re­gions at con­sid­er­able ex­pense. The higher the ex­em­plary pro­file of a pro­ject or meas­ure, the greater its util­ity for the seas and oceans on a global scale.

Synergistic effects: Pro­jects and meas­ures that are to re­ceive fin­an­cial as­sist­ance from the LF must also take into ac­count com­mit­ments from other donor or­gan­iz­a­tions. Re­dund­an­cies in donor work must be avoided, al­though by the same token the activ­it­ies of other donors can cer­tainly be in­teg­rated to cre­ate be­ne­fi­cial syn­er­gistic ef­fects.

Utilization of financial means : The LF al­ways con­siders fin­an­cial aid in terms of the scope and fo­cus of the res­ult­ing con­tri­bu­tion to Found­a­tion goals and to a solu­tion of the es­sen­tial prob­lem as for­mu­lated in the pro­ject ap­plic­a­tion.

How to Apply

For more information please check the Link

Be A Part of Asia’s Largest CSR & Sustainability Forum- India CSR Summit & ESG Forum 2024 | 16th*, 17th & 18th October 2024",Consulting,"Fundraising and Resource Mobilization
Grant Writing: Assisting NGOs and other organizations in writing proposals to secure funding.
Partnership Development: Building partnerships with donors, corporate sector, and government agencies for resource mobilization.
CSR Consulting: Advising corporations on effective Corporate Social Responsibility (CSR) strategies and projects.",,Livelihoods,"Sustainable Fisheries and Coastal Resource Management
Focuses on artisanal marine fisherfolk, promoting sustainable fisheries and balancing coastal resources.
Organizing Fishermen Producer Companies.
Implementing co-management pilot projects in collaboration with state governments.",0.5739065444277921,"Summary
Our work spans various sectors, focusing on agricultural development, HIV risk reduction, sustainable fisheries, financial inclusion, MSME support, and women entrepreneurship. Their approach includes developing and scaling models, providing technical support, knowledge sharing, and engaging in policy shaping to create sustainable livelihoods for marginalized communities.",0.5284722897784632
1,Applications Invited for EnAccess Open Source Project Grant ,"EnAccess 
",Not mentioned,https://ngobox.org/full_grant_announcement_Applications-Invited-for-EnAccess-Open-Source-Project-Grant--EnAccess-_12566,30/09/2024,"

About the Organization

EnAccess supports Open Innovation, Collaboration, and Interoperability in Energy Access. Our vision is a world where everyone has access to safe, clean energy.

EnAccess was founded in 2018 to create a more efficient and collaborative Energy Access sector by identifying, supporting, and promoting Open Innovations to fast-track the race towards SDG7.

About the Grant

EnAccess supports the development and maintenance of Open Source products for the Energy Access sector in different ways, all depending on the scope of the idea.

EnAccess can fund project costs directly in certain cases, for example, projects that are ready to be built and prototyped in a real environment.

We offer technical assistance for Open Source Software, Hardware, and other sorts of toolkits that can be used by the Energy Access sector - Request assistance.

EnAccess offers project certification. This means we can review and ensure the quality of a project and its documentation, host it in our Open Source library, and help create a community around it. Apply to get certified.

How to Apply

If you are seeking funding for an Open Source project that can benefit the Energy Access sector, you can submit a letter of interest.

For more information please check the Link

Be A Part of Asia’s Largest CSR & Sustainability Forum- India CSR Summit & ESG Forum 2024 | 16th*, 17th & 18th October 2024","Health, Livelihoods","Technical Assistance
Sector Expertise: Providing expertise in specific sectors such as health, education, water and sanitation, agriculture, and livelihoods.
Technology Solutions: Implementing technology-based solutions for better project management and service delivery.
Innovation Support: Encouraging and supporting innovative approaches to address social development challenges.","Fundraising and Resource Mobilization
Grant Writing: Assisting NGOs and other organizations in writing proposals to secure funding.
Partnership Development: Building partnerships with donors, corporate sector, and government agencies for resource mobilization.
CSR Consulting: Advising corporations on effective Corporate Social Responsibility (CSR) strategies and projects.","Consulting, Miscellaneous","Fundraising and Resource Mobilization
Grant Writing: Assisting NGOs and other organizations in writing proposals to secure funding.
Partnership Development: Building partnerships with donors, corporate sector, and government agencies for resource mobilization.
CSR Consulting: Advising corporations on effective Corporate Social Responsibility (CSR) strategies and projects.",0.5507605555543558,"Community Engagement and Mobilization
Participatory Approaches: Engaging communities in the planning and implementation of projects to ensure their needs and perspectives are considered.
Awareness Campaigns: Conducting campaigns to raise awareness about social issues like health, education, and gender equality.
Stakeholder Consultation: Facilitating discussions among various stakeholders to build consensus and collaboration.",0.5442155223681799
2,Applications Invited for 2025 RISK Award,"Munich Re Foundation
",Grant Amount: 100000 Euro,https://ngobox.org/full_grant_announcement_Applications-Invited-for-2025-RISK-Award-Munich-Re-Foundation_12565,13/10/2024,"

About the Organization

The Munich Re Foundation was established in 2005 to mark the 125th anniversary of its founder. Munich Re has been dealing with global risks since 1880. Anyone with so much knowledge also bears responsibility. Those who act responsibly must share their knowledge. With the Munich Re Foundation, Munich Re assumes this responsibility. Based in Munich, the foundation is active worldwide, especially in emerging and developing countries.

Munich Re concerns itself with the great challenges facing the world today – population growth, globalisation, diminishing resources, environmental pollution, climate change.

About the Grant

Devastating floods in Brazil in April 2024, widespread flooding in Kenya in May 2024, massive floods in southern Germany and Austria in June 2024, accompanied by very early, very hot heatwaves in India, China, the south-west of the USA and south-east Europe show one thing very clearly: disasters caused by climate hazards are striking more frequently and more intensely around the world. In order to mitigate the worst consequences, we need to take countermeasures with risk management instruments. Disaster risk reduction (DRR) is of particular importance. UNDRR and the Munich Re Foundation are putting the RISK Award at the service of disaster risk reduction and are launching the 2025 RISK Award – Call for Applications.

Apply now for the 2025 RISK Award, endowed with a project funding of up to €100,000!

Topic 2025: ""Children and youths as agents of change for DRR""

Disasters don't discriminate, yet some people are more at risk! This statement is becoming increasingly true. Analyses of the numbers of victims and people affected prove: countries in the Global South are more affected than countries in the Global North, and vulnerable people, such as marginalised groups, children, young people, women, people with disabilities and more, suffer disproportionally. Data from UNDRR shows that over 1 billion children have had their lives disrupted by disasters since 2000, with more than 80,000 schools damaged or destroyed. According to UNICEF, approximately one billion children worldwide are at extremely high risk due to climate impacts, including climate-related disasters.

To address this injustice, we are dedicating the 2025 RISK Award to the topic of ""Children and youths as agents of change for DRR"". It is important to understand that children and young people are not only ""victims"", but also have great potential to become risk managers themselves. They can contribute to their own safety, as well as that of their families and communities, in a variety of ways. This can happen through education and raising awareness, participation in DRR planning and decision making, community engagement as well as youth advocacy, amongst other approaches. Everyone is called upon to participate in disaster risk reduction, so if you are involved in disaster risk reduction projects for and with children and young people, this RISK Award is aiming at you. Our target region is developing and emerging countries in the Global South.

How to Apply

Deadline: 13 October 2024

Apply here

For more information please check the Link

Be A Part of Asia’s Largest CSR & Sustainability Forum- India CSR Summit & ESG Forum 2024 | 16th*, 17th & 18th October 2024","Health, Livelihoods","Fundraising and Resource Mobilization
Grant Writing: Assisting NGOs and other organizations in writing proposals to secure funding.
Partnership Development: Building partnerships with donors, corporate sector, and government agencies for resource mobilization.
CSR Consulting: Advising corporations on effective Corporate Social Responsibility (CSR) strategies and projects.",,Miscellaneous,"Climate X Health
Climate Change Adaptation in Health Systems:
Integrating climate resilience into health facilities, ensuring continuity of healthcare services during emergencies.
Public Health Advocacy and Policy:
Advocating for policies that address climate change impacts on health, such as air quality standards, disaster preparedness, and climate-sensitive disease surveillance.
Engaging in policy dialogue to promote climate-smart health interventions and investments at local, national, and global levels.
Community Awareness and Education:
Conducting awareness campaigns on the health impacts of climate change, emphasizing vulnerable populations such as children, elderly, and those with chronic diseases.
Educating communities on adaptive measures to protect health in the face of climate variability, including heat stress prevention and vector-borne disease management.
Promotion of Sustainable and Resilient Practices:
Promoting sustainable healthcare practices that reduce carbon footprint, such as energy-efficient health facilities, waste management, and renewable energy adoption.
Supporting community-based initiatives for sustainable agriculture, water management, and sanitation to improve environmental health and reduce disease risks.
Research and Data Analysis:
Conducting research on the linkages between climate change and health outcomes, including studies on vector-borne diseases, respiratory illnesses, and mental health impacts.
Analyzing climate and health data to inform evidence-based interventions and policy recommendations.
Capacity Building and Training:Building capacity among healthcare workers and community health volunteers on climate-resilient health practices, emergency response, and disaster risk reduction.Providing training on climate change adaptation strategies in healthcare settings, including the use of climate information for decision-making.
Partnerships and Collaboration:Collaborating with environmental NGOs, government agencies, academic institutions, and international organizations to leverage resources and expertise for climate and health initiatives.Engaging in multi-sectoral partnerships to address broader determinants of health affected by climate change, such as food security, water quality, and ecosystem health.
Monitoring and Evaluation:Monitoring health impacts of climate change and evaluating the effectiveness of interventions in reducing vulnerability and improving resilience.Developing indicators and frameworks for assessing climate-health adaptation strategies and scaling successful models.
Keywords:Health ResilienceClimate-Health ResearchClimate-Sensitive Disease ManagementEnvironmental HealthDisaster Preparedness",0.4668177959628289,"Pandemic & Vaccinations
Awareness and Education Campaigns:
Conducting community outreach programs to educate caregivers and communities about the importance of vaccination.
Dispelling myths and addressing vaccine hesitancy through targeted communication strategies.
Organizing workshops, seminars, and interactive sessions to increase knowledge about vaccine-preventable diseases and vaccination schedules.
Vaccination Drives and Campaigns:
Collaborating with government health authorities to organize mass vaccination campaigns, especially during national immunization days or special vaccination drives.
Mobilizing resources and volunteers to facilitate vaccination sessions in remote or underserved areas.
Providing logistical support such as transportation and cold chain management for vaccine distribution.
Capacity Building and Training:
Training healthcare workers, community health volunteers, and frontline workers on vaccination protocols, storage, administration, and adverse event management.
Building local capacity to monitor and report vaccination coverage data accurately.
Advocacy and Policy Influence:
Advocating for policies that prioritize immunization, ensure vaccine availability, and promote equitable access to vaccines.
Engaging with policymakers, stakeholders, and donors to support sustainable immunization programs and funding initiatives.
Monitoring policy implementation and advocating for improvements in vaccination coverage and service delivery.
Monitoring and Evaluation:
Monitoring vaccination coverage rates and conducting evaluations to assess program effectiveness and identify areas for improvement.
Using data to track immunization trends, identify underserved populations, and implement targeted interventions.
Using and/or developing environmental health surveillance tools for surveillance of pandemic/disease outbreak for example through wastewater surveillance. 
Research and Innovation:
Conducting research on vaccine-preventable diseases, vaccine efficacy, and immunization strategies tailored to local contexts.
Piloting innovative approaches such as mobile vaccination clinics, digital health solutions for tracking vaccination status, or community-based vaccination models.
Partnerships and Collaboration:
Collaborating with international organizations, governments, private sector partners, and other NGOs to leverage resources, expertise, and networks.
Forming alliances with community leaders, religious institutions, schools, and local organizations to promote vaccination acceptance and uptake.
Emergency Response and Crisis Management:
Responding to disease outbreaks or emergencies by supporting rapid vaccination campaigns and emergency preparedness plans.
Mobilizing resources and coordinating efforts with health authorities and humanitarian agencies during health crises.
Keywords:
Vaccine
Vaccination
Pandemic
Outbreak",0.4634306376961019
3,Applications Invited for Just One More Foundation Grants,"Just One More Foundation
",Not mentioned,https://ngobox.org/full_grant_announcement_Applications-Invited-for-Just-One-More-Foundation-Grants-Just-One-More-Foundation_12564,30/09/2024,"Organization: Just One More Foundation Apply By: 30 Sep 2024



About the Organization

Just One More Foundation is dedicated to inspiring hope and providing opportunity for individuals who have experienced hardships and the organizations that serve them.

We “give help and give hope” to those who have a constructive plan to overcome the obstacles that have left them feeling defeated. With hard work and support, people in need will rise to new heights!

About the Grant

We focus our grants in the areas of:

Mental Health

Drug Misuse

Health Challenges

Education

We give grants to both individuals and nonprofit organizations.

Grants for Individuals:

If you are an individual who has experienced hardships and now have a constructive plan to overcome your obstacles, we are interested in hearing from you. While we carefully consider all submitted applications, we prefer to fund educational tuition-based grants, such as undergraduate, graduate or training programs.

Grants for Nonprofits:

If you represent a nonprofit organization that helps individuals willing to do hard work to overcome their obstacles, we are interested in hearing from you.

How to Apply

There are two funding cycles each year. We accept one application per individual or non-profit organization per funding cycle.

We are focused on U.S. based non-profit organizations that focus their work in the United States.

For the individual grants we are focused on helping those across the United States. While we carefully consider all submitted applications, we prefer to fund educational tuition-based grants, such as undergraduate, graduate or training programs.

Second Round 2024: grant applications will be accepted from July 1-September 30 and grantees will be notified in November 2024.

For more information please check the Link

Be A Part of Asia’s Largest CSR & Sustainability Forum- India CSR Summit & ESG Forum 2024 | 16th*, 17th & 18th October 2024","Health, Miscellaneous","Fundraising and Resource Mobilization
Grant Writing: Assisting NGOs and other organizations in writing proposals to secure funding.
Partnership Development: Building partnerships with donors, corporate sector, and government agencies for resource mobilization.
CSR Consulting: Advising corporations on effective Corporate Social Responsibility (CSR) strategies and projects.","Summary
Our work spans various sectors, focusing on agricultural development, HIV risk reduction, sustainable fisheries, financial inclusion, MSME support, and women entrepreneurship. Their approach includes developing and scaling models, providing technical support, knowledge sharing, and engaging in policy shaping to create sustainable livelihoods for marginalized communities.",Irrelevant,"Fundraising and Resource Mobilization
Grant Writing: Assisting NGOs and other organizations in writing proposals to secure funding.
Partnership Development: Building partnerships with donors, corporate sector, and government agencies for resource mobilization.
CSR Consulting: Advising corporations on effective Corporate Social Responsibility (CSR) strategies and projects.",0.5667520825816125,"Primary Health
Healthcare Delivery and Services:
Primary Health Centers (PHCs): NGOs often support or establish PHCs to provide essential healthcare services in remote and underserved areas.
Mobile Clinics: Providing healthcare services through mobile units that reach remote and rural populations who lack access to fixed health facilities.
Community Health Workers: Training and deploying community health workers to offer basic healthcare, health education, and referrals.
Health Education and Awareness:
Health Promotion Campaigns: Conducting awareness campaigns on various health issues such as hygiene, nutrition, maternal and child health, infectious diseases, and non-communicable diseases.
Behavior Change Communication: Implementing programs to change health-related behaviors and practices through education and engagement.
Maternal and Child Health:
Antenatal and Postnatal Care: Providing care and support to pregnant women and new mothers to ensure safe pregnancies and healthy babies.
Immunization Programs: Facilitating immunization drives to protect children from vaccine-preventable diseases.
Disease Prevention and Management:
Infectious Diseases: Addressing diseases such as tuberculosis, malaria, and HIV/AIDS through prevention, treatment, and support programs.
Non-Communicable Diseases: Offering screening, prevention, and management programs for conditions such as diabetes, hypertension, and cardiovascular diseases.
Water, Sanitation, and Hygiene (WASH):
Sanitation Infrastructure: Building and promoting the use of toilets and sanitation facilities to reduce the incidence of waterborne diseases.
Clean Water Access: Ensuring communities have access to clean and safe drinking water.
Mental Health:
Counseling and Support Services: Providing mental health services, including counseling and support for individuals dealing with stress, anxiety, depression, and other mental health issues.
Awareness Programs: Raising awareness about mental health issues and reducing stigma.
Advocacy and Policy Influence:
Health Policy Advocacy: Engaging with policymakers to advocate for better health policies, increased funding for healthcare, and improvements in healthcare infrastructure.
Community Mobilization: Empowering communities to demand better health services and participate in decision-making processes.
Research and Data Collection:
Health Surveys and Studies: Conducting research to identify health needs, evaluate program effectiveness, and generate evidence for advocacy and policy change.
Monitoring and Evaluation: Implementing robust monitoring and evaluation systems to track progress and impact of health programs.
Capacity Building:
Training Healthcare Workers: Providing training and capacity-building programs for healthcare providers, including doctors, nurses, and community health workers.
Strengthening Health Systems: Supporting health systems strengthening initiatives to improve the quality and efficiency of healthcare delivery.
Primary Health
Community health centers
Maternal and child health
Immunization
Disease prevention
Health education
Basic healthcare services
Primary care clinics
Health promotion
Nutritional support
Sanitation and hygiene",0.48627362181259887
